{
  "meta": {
    "schema_version": "0.1",
    "retrieved_at": "2026-02-21",
    "last_verified_at": "2026-02-21",
    "default_currency": "USD",
    "notes": "Starter dataset for schema + API wiring. Values are placeholders and unverified."
  },
  "sources": [
    {
      "id": "example_source",
      "url": "https://example.com",
      "retrieved_at": "2026-02-21",
      "verified": false,
      "notes": "Replace with an official pricing URL."
    }
  ],
  "api_rates": [
    {
      "provider": "example",
      "channel": "api",
      "model": "example-model",
      "unit": "usd_per_1m_tokens",
      "rates": { "input": 1.0, "output": 5.0 },
      "source_ids": ["example_source"],
      "verified": false,
      "notes": "Replace with a real model + official rates."
    }
  ],
  "subscriptions": [
    {
      "provider": "example",
      "product": "Example App",
      "plan_id": "example-pro",
      "price_usd_per_month": 20,
      "usage_limits": "Opaque quota (example text).",
      "source_ids": ["example_source"],
      "verified": false
    }
  ],
  "tool_plans": [
    {
      "tool": "Example Tool",
      "plan_id": "example-tool-pro",
      "pricing_type": "api_pool_usd",
      "subscription_price_usd": 20,
      "included_pool_usd": 20,
      "overage_policy": "payg_after_pool",
      "metering": "Token-metered at underlying API list prices.",
      "source_ids": ["example_source"],
      "verified": false
    }
  ]
}
